{
  "$schema": "https://json-schema.org/draft/2020-12/schema",
  "title": "JapaneseRapAuditEvidence",
  "type": "object",
  "required": ["bars", "independent_review", "audio_reviewed"],
  "properties": {
    "bars": {
      "type": "array",
      "minItems": 1,
      "items": {
        "type": "object",
          "required": [
            "index", "tokens", "rhyme_hits", "changes",
            "naturalness_review", "interesting_without_rhyme_review",
            "ai_pattern_flags"
          ],
        "properties": {
          "index": {"type": "integer", "minimum": 1},
          "surface": {"type": ["string", "null"]},
          "tokens": {"type": "array", "minItems": 1, "items": {"type": "object"}},
          "rhyme_hits": {
            "type": "array",
            "items": {
              "type": "object",
              "required": ["family", "position"],
              "properties": {
                "family": {"type": "string"},
                "position": {
                  "enum": ["initial", "internal", "caesura", "end", "cross_bar"]
                },
                "meaning_bearing": {"type": "boolean"},
                "grammar_tail_only": {"type": "boolean"},
                "reading_confidence": {"type": "number", "minimum": 0, "maximum": 1}
              },
              "additionalProperties": false
            }
          },
          "changes": {
            "type": "array",
            "items": {"enum": ["information", "emotion", "flow"]}
          },
          "naturalness_review": {
            "type": "object",
            "properties": {
              "status": {"enum": ["pass", "fail", "unknown"]},
              "evidence": {"type": "string", "minLength": 1}
            },
            "required": ["status", "evidence"],
            "additionalProperties": false
          },
          "interesting_without_rhyme_review": {
            "type": "object",
            "properties": {
              "status": {"enum": ["pass", "fail", "unknown"]},
              "evidence": {"type": "string", "minLength": 1}
            },
            "required": ["status", "evidence"],
            "additionalProperties": false
          },
          "ai_pattern_flags": {
            "type": "array",
            "items": {"type": "string"}
          }
        },
        "additionalProperties": true
      }
    },
    "setups": {
      "type": "array",
      "items": {
        "type": "object",
        "required": ["id", "bar", "expected_payoff_id"],
        "properties": {
          "id": {"type": "string"},
          "bar": {"type": "integer"},
          "expected_payoff_id": {"type": "string"}
        }
      }
    },
    "payoffs": {
      "type": "array",
      "items": {
        "type": "object",
        "required": ["id", "bar", "setup_id", "mechanism"],
        "properties": {
          "id": {"type": "string"},
          "bar": {"type": "integer"},
          "setup_id": {"type": "string"},
          "mechanism": {"type": "string"}
        }
      }
    },
    "named_entities": {
      "type": "array",
      "items": {
        "type": "object",
        "required": ["surface", "bar", "function"],
        "properties": {
          "surface": {"type": "string"},
          "bar": {"type": "integer"},
          "function": {"type": "string"}
        }
      }
    },
    "independent_review": {"type": "boolean"},
    "audio_reviewed": {"type": "boolean"},
    "expected_bar_count": {"type": ["integer", "null"], "minimum": 1},
    "technical_rhyme_brief": {"type": "boolean"},
    "intentional_end_rhyme_reason": {"type": ["string", "null"]}
  },
  "additionalProperties": true
}
