{
  "bars": [
    {
      "index": 1,
      "tokens": [
        {
          "surface": "周回",
          "concreteness": 0.5
        },
        {
          "surface": "何周目",
          "concreteness": 0.5
        }
      ],
      "rhyme_hits": [
        {
          "family": "uuai_shuukai",
          "position": "internal",
          "meaning_bearing": true,
          "grammar_tail_only": false,
          "reading_confidence": 0.9
        }
      ],
      "changes": [
        "information"
      ],
      "naturalness_review": {
        "status": "pass",
        "evidence": "口語の自問として自然"
      },
      "interesting_without_rhyme_review": {
        "status": "pass",
        "evidence": "何度目のループかという問いが命題として立つ"
      },
      "ai_pattern_flags": []
    },
    {
      "index": 2,
      "tokens": [
        {
          "surface": "初期設定",
          "concreteness": 0.45
        },
        {
          "surface": "ハードモード",
          "concreteness": 0.5
        }
      ],
      "rhyme_hits": [],
      "changes": [
        "information"
      ],
      "naturalness_review": {
        "status": "pass",
        "evidence": "体言止め2連だがフックの電報体として自然"
      },
      "interesting_without_rhyme_review": {
        "status": "pass",
        "evidence": "人生=難易度固定という命題"
      },
      "ai_pattern_flags": []
    },
    {
      "index": 3,
      "tokens": [
        {
          "surface": "セリフ",
          "concreteness": 0.7
        },
        {
          "surface": "モブ",
          "concreteness": 0.6
        },
        {
          "surface": "配役",
          "concreteness": 0.55
        }
      ],
      "rhyme_hits": [
        {
          "family": "aiau",
          "position": "end",
          "meaning_bearing": true,
          "grammar_tail_only": false,
          "reading_confidence": 0.9
        }
      ],
      "changes": [
        "information"
      ],
      "naturalness_review": {
        "status": "pass",
        "evidence": "自然"
      },
      "interesting_without_rhyme_review": {
        "status": "pass",
        "evidence": "台詞なしの端役を割り当てられたという自己規定"
      },
      "ai_pattern_flags": []
    },
    {
      "index": 4,
      "tokens": [
        {
          "surface": "改札",
          "concreteness": 0.9
        },
        {
          "surface": "回る",
          "concreteness": 0.7
        }
      ],
      "rhyme_hits": [
        {
          "family": "aiau",
          "position": "end",
          "meaning_bearing": true,
          "grammar_tail_only": false,
          "reading_confidence": 0.9
        }
      ],
      "changes": [
        "information",
        "emotion"
      ],
      "naturalness_review": {
        "status": "pass",
        "evidence": "『回ってんのは』の口語縮約は自然"
      },
      "interesting_without_rhyme_review": {
        "status": "pass",
        "evidence": "周回の正体が通勤の改札だと判明するturn(HD01)"
      },
      "ai_pattern_flags": []
    },
    {
      "index": 5,
      "tokens": [
        {
          "surface": "トラック",
          "concreteness": 0.9
        },
        {
          "surface": "来ない",
          "concreteness": 0.6
        }
      ],
      "rhyme_hits": [],
      "changes": [
        "information"
      ],
      "naturalness_review": {
        "status": "pass",
        "evidence": "自然"
      },
      "interesting_without_rhyme_review": {
        "status": "pass",
        "evidence": "転生装置(トラック)は来ないという待機の告白"
      },
      "ai_pattern_flags": []
    },
    {
      "index": 6,
      "tokens": [
        {
          "surface": "ステータス画面",
          "concreteness": 0.8
        },
        {
          "surface": "残高",
          "concreteness": 0.85
        }
      ],
      "rhyme_hits": [],
      "changes": [
        "information"
      ],
      "naturalness_review": {
        "status": "pass",
        "evidence": "自然"
      },
      "interesting_without_rhyme_review": {
        "status": "pass",
        "evidence": "ゲームUIと銀行残高の二重写し(S2)"
      },
      "ai_pattern_flags": []
    },
    {
      "index": 7,
      "tokens": [
        {
          "surface": "台本",
          "concreteness": 0.8
        },
        {
          "surface": "書き換える",
          "concreteness": 0.6
        }
      ],
      "rhyme_hits": [
        {
          "family": "aio_slant",
          "position": "end",
          "meaning_bearing": true,
          "grammar_tail_only": false,
          "reading_confidence": 0.7
        }
      ],
      "changes": [
        "information",
        "emotion"
      ],
      "naturalness_review": {
        "status": "pass",
        "evidence": "自然"
      },
      "interesting_without_rhyme_review": {
        "status": "pass",
        "evidence": "いつか台本を書き換えるという意志の種"
      },
      "ai_pattern_flags": []
    },
    {
      "index": 8,
      "tokens": [
        {
          "surface": "クソシナリオ",
          "concreteness": 0.6
        }
      ],
      "rhyme_hits": [
        {
          "family": "aio_slant",
          "position": "end",
          "meaning_bearing": true,
          "grammar_tail_only": false,
          "reading_confidence": 0.7
        }
      ],
      "changes": [
        "emotion"
      ],
      "naturalness_review": {
        "status": "pass",
        "evidence": "自然"
      },
      "interesting_without_rhyme_review": {
        "status": "pass",
        "evidence": "現実への命名=タイトル級フレーズ"
      },
      "ai_pattern_flags": []
    },
    {
      "index": 9,
      "tokens": [
        {
          "surface": "ダンジョン",
          "concreteness": 0.7
        },
        {
          "surface": "満員電車",
          "concreteness": 0.9
        }
      ],
      "rhyme_hits": [],
      "changes": [
        "information"
      ],
      "naturalness_review": {
        "status": "pass",
        "evidence": "自然"
      },
      "interesting_without_rhyme_review": {
        "status": "pass",
        "evidence": "朝の満員電車をダンジョンと呼ぶ場面転換"
      },
      "ai_pattern_flags": []
    },
    {
      "index": 10,
      "tokens": [
        {
          "surface": "タイムカード",
          "concreteness": 0.9
        },
        {
          "surface": "クエスト",
          "concreteness": 0.6
        }
      ],
      "rhyme_hits": [],
      "changes": [
        "information"
      ],
      "naturalness_review": {
        "status": "pass",
        "evidence": "『切ってクエスト』は省略的だが口語で回復可能"
      },
      "interesting_without_rhyme_review": {
        "status": "pass",
        "evidence": "打刻=クエスト受注という対応"
      },
      "ai_pattern_flags": []
    },
    {
      "index": 11,
      "tokens": [
        {
          "surface": "ステータスオープン",
          "concreteness": 0.6
        },
        {
          "surface": "経験値",
          "concreteness": 0.6
        }
      ],
      "rhyme_hits": [],
      "changes": [
        "information"
      ],
      "naturalness_review": {
        "status": "pass",
        "evidence": "掛け声構文として自然"
      },
      "interesting_without_rhyme_review": {
        "status": "pass",
        "evidence": "能力値開示の期待を立てる(HD02 setup)"
      },
      "ai_pattern_flags": []
    },
    {
      "index": 12,
      "tokens": [
        {
          "surface": "カンスト",
          "concreteness": 0.6
        },
        {
          "surface": "時給",
          "concreteness": 0.9
        },
        {
          "surface": "据え置き",
          "concreteness": 0.6
        }
      ],
      "rhyme_hits": [],
      "changes": [
        "information",
        "emotion"
      ],
      "naturalness_review": {
        "status": "pass",
        "evidence": "自然"
      },
      "interesting_without_rhyme_review": {
        "status": "pass",
        "evidence": "経験値は上限でも時給は据え置きという皮肉の着地"
      },
      "ai_pattern_flags": []
    },
    {
      "index": 13,
      "tokens": [
        {
          "surface": "親ガチャ",
          "concreteness": 0.6
        },
        {
          "surface": "配布済み",
          "concreteness": 0.6
        }
      ],
      "rhyme_hits": [
        {
          "family": "aiu_haifu",
          "position": "cross_bar",
          "meaning_bearing": true,
          "grammar_tail_only": false,
          "reading_confidence": 0.8
        }
      ],
      "changes": [
        "information"
      ],
      "naturalness_review": {
        "status": "pass",
        "evidence": "自然"
      },
      "interesting_without_rhyme_review": {
        "status": "pass",
        "evidence": "初期条件は出生時に配布済み(S3)。親個人を責めない"
      },
      "ai_pattern_flags": []
    },
    {
      "index": 14,
      "tokens": [
        {
          "surface": "リセマラ",
          "concreteness": 0.6
        },
        {
          "surface": "非対応",
          "concreteness": 0.5
        }
      ],
      "rhyme_hits": [
        {
          "family": "desumasu",
          "position": "end",
          "meaning_bearing": true,
          "grammar_tail_only": true,
          "reading_confidence": 0.9
        }
      ],
      "changes": [
        "information",
        "flow"
      ],
      "naturalness_review": {
        "status": "pass",
        "evidence": "敬体は運営告知の役割声として動機付けられている"
      },
      "interesting_without_rhyme_review": {
        "status": "pass",
        "evidence": "人生は引き直し不可という告知"
      },
      "ai_pattern_flags": []
    },
    {
      "index": 15,
      "tokens": [
        {
          "surface": "天井",
          "concreteness": 0.7
        },
        {
          "surface": "ございません",
          "concreteness": 0.3
        }
      ],
      "rhyme_hits": [
        {
          "family": "desumasu",
          "position": "end",
          "meaning_bearing": true,
          "grammar_tail_only": true,
          "reading_confidence": 0.9
        }
      ],
      "changes": [
        "information"
      ],
      "naturalness_review": {
        "status": "pass",
        "evidence": "慇懃な告知体は register collision として意図的"
      },
      "interesting_without_rhyme_review": {
        "status": "pass",
        "evidence": "救済ライン(天井)の不在=課金ガチャ以下の設計"
      },
      "ai_pattern_flags": []
    },
    {
      "index": 16,
      "tokens": [
        {
          "surface": "チュートリアル",
          "concreteness": 0.6
        },
        {